Name,Rating,Price(INR)
Blossom Marathi Rhymes Books for Kids 3 to 7 Years | Marathi Badbad Geete with Colourful Pictures | 44 Nursery Rhymes / Poetry in each books | 2 Books [Paperback] Content Team at Target Publications,4.6 out of 5 stars,130
Kidsluster Growth Diary Of Good Kids I Children's Inspirational Story Books Ideal for 6 to 12 Year Old Children (Set of 10 books) (Kidsluster),4.0 out of 5 stars,"2,099"
JAIIB - IIBF - New 2023 Syllabus - Set of 4 Books by Macmillan - PPB + Accounting & Finance + Retail Banking + Indian Economy & Indian Financial System,4.5 out of 5 stars,"2,800"
"English phonics book, phonics reader level 2 , Vowel Letter sounds , phonics activity book , Phonics books 4 years, Phonics worksheets ,Letter sounds book, A-Z Sounds,",3.9 out of 5 stars,175
The Psychology of Money,4.6 out of 5 stars,210
"Isapniti 101 Chan Chan Goshti, Chhan Chhan Children Bodhkatha Book in Marathi, बाल कथा, लहान मुलांच्या छान छान गोष्टी पुस्तके, बालसाहित्य मराठी पुस्तक Isapaniti इसापनीती पुस्तकं, बोधकथा बुक, बालकथा बुक्स, Balsahitya Bestseller Moral Stories बेस्ट सेलर Esapniti Aesop",4.5 out of 5 stars,220
101 Maze Activity Book: Fun Activity Book For Children,4.3 out of 5 stars,149
Mental Maths - Mathematics Activity Book 2,4.5 out of 5 stars,91
First All In One - Writing  Book (Practice),4.4 out of 5 stars,91
"Pride and Prejudice: A Timeless Romance of Wit, Love, and Social Intrigue",4.5 out of 5 stars,0
इकिगाई मराठी | Ikigai (Marathi Book) | दीर्घायुषी निरोगी आणि आनंदी जीवनाचे जपानी रहस्य | Japanese secret of Happy and long healthy life : In search of Purpose of life,4.5 out of 5 stars,138
World’s Greatest Books For Personal Growth & Wealth (Set of 4 Books): Perfect Motivational Gift Set,4.5 out of 5 stars,325
Hello Mr. Pen Cursive Writing Book 5 - Handwriting Improvement Books - Cursive Writing Books for 10+ Years - Hand Writing Practice Books Kids - Writing Book for Kids,4.2 out of 5 stars,160
"Flags of the World - Sticker Coloring Activity Book For Children : Continent, Country, Capital, Language and Currency",4.5 out of 5 stars,249
English The Parable of the Pipeline Set of 6 Books - Rich dad the business school +Copycat Marketing +Question are the answer + The parable of the pipeline+Talk the talk +whole stole,3.8 out of 5 stars,397
NCERT Science (PCB) for Class 11 Books Set 11 (English Medium) (5 Books) Hardcover – 1 January 2019,4.0 out of 5 stars,710
The Plant Based Air Fryer Cookbook: The Complete Delicious Healthy Whole Food Vegan Recipes Collection To Save Money and Lose Weight,,0
English The Parable of the Pipeline Set of 6 Books - Rich dad the business school +Copycat Marketing +Question are the answer + The parable of the pipeline+Talk the talk +whole stole,3.8 out of 5 stars,397
NCERT Science (PCB) for Class 11 Books Set 11 (English Medium) (5 Books) Hardcover – 1 January 2019,4.0 out of 5 stars,710
PSI-STI-ASO - Pariksha Margadarshak - Tatyancha Thokla - Eknath Patil (Tatya) - 30th Ed./2023,4.4 out of 5 stars,490
"MTG International Mathematics Olympiad (IMO) Workbook for Class 9 - MCQs, Previous Years Solved Paper and Achievers Section - SOF Olympiad Preparation Books For 2023-2024 Exam",,78
"108 Moral Stories (Illustrated) - Story Book for Kids - English Short Stories with Colourful Pictures - Bedtime Children Story Book - 4 Years to 10 Years Old Children - Read Aloud to Infants, Toddlers",4.4 out of 5 stars,125
"How the Earth Got Its Beauty: Puffin Chapter Book: Gorgeous new full colour, illustrated chapter book for young readers from ages 5 and up by Sudha Murty [Hardcover] Murty, Sudha",4.6 out of 5 stars,160
"Pride and Prejudice: A Timeless Romance of Wit, Love, and Social Intrigue",4.5 out of 5 stars,0
BOOKS OF CHART PATTERNS AND CANDLESTICK PATTERNS (HINDI EDITION),5.0 out of 5 stars,289
"MTG National Science Olympiad (NSO) Workbook for Class 6 - Quick Recap, MCQs, Previous Years Solved Paper and Achievers Section - SOF Olympiad Preparation Books For 2023-2024 Exam",,100
"Ikigai: The Japanese secret to a long and happy life [Hardcover] García, Héctor and Miralles, Francesc",4.6 out of 5 stars,329
"IIBF-JAIIB: New 2023 Syllabus & Pattern - 2000 Practice Questions & Solutions | Indian Economy and Financial System (IE&IFS), Principles and Practices of Banking (PPB), Accounting & Financial Management for Bankers (AFM), Retail Banking and Wealth Management (RBWM)",4.3 out of 5 stars,494
Blossom Marathi Rhymes Books for Kids 3 to 7 Years | Marathi Badbad Geete with Colourful Pictures | 44 Nursery Rhymes / Poetry in each books | 2 Books [Paperback] Content Team at Target Publications,4.6 out of 5 stars,130
India 2023 Annual Reference Year Book for Civil Services and Other Competitive Examinations KE&,5.0 out of 5 stars,414
My First Pop-Up Fairy Tales - Three Little Pigs : Pop up Books for children,4.3 out of 5 stars,129
The Plant Based Air Fryer Cookbook: The Complete Delicious Healthy Whole Food Vegan Recipes Collection To Save Money and Lose Weight,,0
MTG International General Knowledge Olympiad (IGKO) Workbook for Class 2 - MCQs & Achievers Section - SOF IGKO Olympiad Preparation Books For 2023-2024 Exam,,85
Blossom Marathi Rhymes Books for Kids 3 to 7 Years | Marathi Badbad Geete with Colourful Pictures | 44 Nursery Rhymes / Poetry in each books | 2 Books [Paperback] Content Team at Target Publications,4.6 out of 5 stars,130
"Price Action Trading : Share Market Books in Marathi Indian Stock Option Technical Analysis & Investing, Learning Guide Zone Bazar Book : द शेअर मार्केट, Sharemarket on Intraday with trends charts इंट्राडे ट्रेडिंग, मराठी पुस्तक, प्राइस एक्शन बुक, बाजार इन झोन Bazaar, Bajar",4.5 out of 5 stars,147
My First Pop-Up Fairy Tales - Three Little Pigs : Pop up Books for children,4.3 out of 5 stars,129
முன் ஜென்ம தேடல் நீ என் சகியே... : ( 86 - 90 ) (Tamil Edition),5.0 out of 5 stars,0
Inspector Chalisa Maths Calculation ka Maha Granth | 4000+ MCQ'S Bilingual Book | Mohit Goyal Sir | 2023-Edition |,5.0 out of 5 stars,165
"MTG International Mathematics Olympiad (IMO) Workbook for Class 1 - MCQs, Previous Years Solved Paper and Achievers Section - SOF Olympiad Preparation Books For 2023-2024 Exam",,100
"Blossom Jumbo Creative Colouring Book for Kids 3 years to 5 years old | Best Drawing, Coloring, Painting and Art Book for Children with Color Reference Guide | A3 Size Colour Book for Kids | Level 1",4.5 out of 5 stars,176
Prahar (Ashwin Pandit Book 5) (Hindi Edition),4.4 out of 5 stars,0
"Oswaal NTA CUET (UG) Mock Test Sample Question Papers English, Accountancy, Business Studies & Economics (Set of 4 Books)(Entrance Exam Preparation Book 2023)",4.0 out of 5 stars,693
101 Tales The Great Panchatantra Collection - Collection Of Witty Moral Stories For Kids For Personality Development,4.5 out of 5 stars,399
Unicorn Reusable Sticker Book For Children,4.4 out of 5 stars,209
UPSC EPFO (Enforcement Officers/ Accounts Officers) Exam Guide 2nd Edition,4.2 out of 5 stars,357
Rich Dad Poor Dad - 20Th Anniversary Edition - Hindi,4.5 out of 5 stars,260
MTG International General Knowledge Olympiad (IGKO) Workbook for Class 2 - MCQs & Achievers Section - SOF IGKO Olympiad Preparation Books For 2023-2024 Exam,,85
1001 Ultimate Brain Booster Activities for 3 to 6 Years Old Kids,4.5 out of 5 stars,262
NCERT Science And Mathematics Textbook For Class - 10 ( Set Of 2 Books ),4.3 out of 5 stars,355
My First Shaped Board Book: Illustrated Lord Krishna Hindu Mythology Picture Book for Kids Age 2+ (Indian Gods and Goddesses),4.5 out of 5 stars,89
BlackBook of Samanya Jagrukta (General Awareness) Hindi March 2023 by Nikhil Gupta,5.0 out of 5 stars,349
"MHT-CET Physics, Chemistry and Maths Test Series Book for Engineering and Pharmacy Entrance Exam | MHTCET PCM Book | Includes 4590 MCQs , Topic Tests, Model Test Paper and Revision Test",3.6 out of 5 stars,478
"Spirituality For Leadership & Success (Box-Set of 5 Books): Gita, Vedanta, Hinduism, Buddha, Vivekananda",4.3 out of 5 stars,399
Examcart CRPF Constable Tradesman & Technical Study Practice set book For 2023 Exams in hindi,5.0 out of 5 stars,135
Grandparents' Bag of Stories [Paperback] Sudha Murty,4.7 out of 5 stars,180
Forced Marriage,5.0 out of 5 stars,246
"Target VITEEE 2023 - 16 Previous Year (2022 - 2006) Solved Papers with 10 Mock Tests 12th Edition | Physics, Chemistry, Mathematics, & Quantitative Aptitude 3050 PYQs",4.3 out of 5 stars,590
"MTG National Cyber Olympiad (NCO) Workbook for Class 4 - Quick Recap, MCQs, Previous Years Solved Paper and Achievers Section - SOF NCO Olympiad Preparation Books For 2023-2024 Exam",,100
"Price Action Trading : Share Market Books in Marathi Indian Stock Option Technical Analysis & Investing, Learning Guide Zone Bazar Book : द शेअर मार्केट, Sharemarket on Intraday with trends charts इंट्राडे ट्रेडिंग, मराठी पुस्तक, प्राइस एक्शन बुक, बाजार इन झोन Bazaar, Bajar",4.5 out of 5 stars,147
Moo On the Farm Sound Book ( Board book for children) (Sound Book Series),3.6 out of 5 stars,465
The Book of Five Rings,4.5 out of 5 stars,171
"MTG International Mathematics Olympiad (IMO) Workbook for Class 1 - MCQs, Previous Years Solved Paper and Achievers Section - SOF Olympiad Preparation Books For 2023-2024 Exam",,100
Meri Pratham Hindi Sulekh Varnmala,4.4 out of 5 stars,99
Moral Story Books for Kids (Pack of 10 Books) | 160 Total Pages | Illustrated Stories for Children 2 to 6 year old,4.4 out of 5 stars,280
"Story Book for Kids (Set of 10 Books) - Aesop's Fables - Moral Stories - Bedtime Stories - 3 Years to 10 Years old - English Short Stories for Kids - Read Aloud to Infants, Toddlers",4.1 out of 5 stars,245
Moral Story Books for Kids (Pack of 10 Books) | 160 Total Pages | Illustrated Stories for Children 2 to 6 year old,4.4 out of 5 stars,280
Cold & Deadly: A Thrilling Romantic Suspense (Cold Justice® - The Negotiators Book 1),4.6 out of 5 stars,425
"Story Book for Kids (Set of 10 Books) - Aesop's Fables - Moral Stories - Bedtime Stories - 3 Years to 10 Years old - English Short Stories for Kids - Read Aloud to Infants, Toddlers",4.1 out of 5 stars,245
"KENDRIYA VIDYALAYA SCHOOL NCERT BOOK SET CLASS - 9 ( SPARSH , SANCHAYAN , BEEHIVE , MOMENTS , WORD AND EXPRESSIONS , SCIENCE , MATHS , HISTORY , GEOGRAPHY , ECONOMICS , POLITICAL ) 2022 EDITION",3.0 out of 5 stars,"1,065"
"Captivated By You: Raizada Brothers, Book 1 (An Indian Mafia Romance)",4.7 out of 5 stars,0
Guide for Hotel Management 2023,4.1 out of 5 stars,419
"MTG National Cyber Olympiad (NCO) Workbook for Class 3 - Quick Recap, MCQs, Previous Years Solved Paper and Achievers Section - SOF NCO Olympiad Preparation Books For 2023-2024 Exam",,85
"Mossad: Israeli Most Secret Service Book Marathi, मोसाद मराठी अनुवादीत बुक्स, Novel Books in, इस्रायलची बुक, मोसाड पुस्तक, इस्राएलच्या पुस्तके, Israel Chi Musad, Israelchi Moosad, Istrailacha Mosad",4.4 out of 5 stars,253
365 Colouring Book for Kids - Painting and Drawing Book with 368 Big Pictures,4.6 out of 5 stars,291
"My First Shaped Board Book - Dog, Die-Cut Animals, Picture Book for Children",4.7 out of 5 stars,89
"Sampurna Garbhasanskar : संपूर्ण गर्भसंस्कार पुस्तक मराठी बुक्स, Pregnancy Books in Marathi Ayurvedik Garbhasanskar Book पुस्तके, Aayurvedik Garbh Sanskar Pregnant Women (आयुर्वेदिक गर्भ संस्कार बुक) Garbhavastha Ayurvedic, Garbha Vidya Ayurvedic, Tambe Guide, Before During and After, बालाजी Mother & Baby Care गर्भवती महिला Balaji स्त्री आयुर्वेदीय Ayurvediya + तांबे",4.2 out of 5 stars,157
MTG 51 English Grammar Worksheets Class 3 – Grammar Work books to practice English concepts in interactive way (Based on CBSE/NCERT),4.5 out of 5 stars,190
KARMA: A YOGI'S GUIDE TO CRAFTING YOUR DESTINY,4.7 out of 5 stars,189
Physics Wallah CUET UG English Book (Common University Entrance Test 2023),3.6 out of 5 stars,280
BAYAM (Tamil Edition),,0
"NCERT , CLASS - 12 SET OF 8 BOOKS ( MATHEMATICS PART 1 & 2 , CHEMISTRY PART 1 & 2 , PHYSICS PART 1 & 2 , FLEMINGO , VISTAS ) 2022 EDITION",2.7 out of 5 stars,990
365 Colouring Book for Kids - Painting and Drawing Book with 368 Big Pictures,4.6 out of 5 stars,291
"black roses - poems about love, heartbreak, self love, depression, healing, grief and loss: Poetry books for women - Poem books about mental health - Poetry collection for young people & teens",3.6 out of 5 stars,0
"My First Shaped Board Book - Dog, Die-Cut Animals, Picture Book for Children",4.7 out of 5 stars,89
"Sampurna Garbhasanskar : संपूर्ण गर्भसंस्कार पुस्तक मराठी बुक्स, Pregnancy Books in Marathi Ayurvedik Garbhasanskar Book पुस्तके, Aayurvedik Garbh Sanskar Pregnant Women (आयुर्वेदिक गर्भ संस्कार बुक) Garbhavastha Ayurvedic, Garbha Vidya Ayurvedic, Tambe Guide, Before During and After, बालाजी Mother & Baby Care गर्भवती महिला Balaji स्त्री आयुर्वेदीय Ayurvediya + तांबे",4.2 out of 5 stars,157
KARMA: A YOGI'S GUIDE TO CRAFTING YOUR DESTINY,4.7 out of 5 stars,189
Physics Wallah CUET UG English Book (Common University Entrance Test 2023),3.6 out of 5 stars,280
Roar in the Jungle Sound Book ( Board book for children) (Sound Book Series),3.1 out of 5 stars,431
"201 English Activity Book - Fun Activities and Grammar Exercises For Children: Alphabet & Words, Rhyming & Opposites",4.4 out of 5 stars,95
Frank EMU Books Mental Maths for Class 2 Practice Workbook with Fun Activities Based on NCERT Guidelines (Age 6 Years and Above),4.3 out of 5 stars,158
"My First Mythology Tale (Illustrated) (Set of 5 Books) (Hindi) - Mahabharata, Krishna, Hanuman, Ganesha, Ramayana - Story Book for Kids",4.4 out of 5 stars,187
YOU DON'T NEED DRUGS TO STOP ANXIETY: Just 9 Mindfulness Strategies To Overcome Anxiety,5.0 out of 5 stars,0
"MHT-CET 20 Question Papers Set Book | MHT CET Books | 11, 12 Syllabus - Maharashtra Board | Physics Chemistry Maths Biology (PCMB) Sample Papers",4.4 out of 5 stars,470
Peppa Pig: 1000 First Words Sticker Book,4.6 out of 5 stars,224
Spoken English Guru Practice Exercises Book (Basic to Advance Level - English Grammar & Spoken English Topics Practice),4.4 out of 5 stars,252
Sab Kuch Psychology Hai,4.0 out of 5 stars,218
Don't Believe Everything You Think,4.6 out of 5 stars,209
Don't Believe Everything You Think,4.6 out of 5 stars,209
"Stories from the Ramayana and the Mahabharata (Set of 2 Books) (Illustrated) - Story Books for kids - Bedtime Stories - 4 years to 10 Years old - English Stories for Children - Read Aloud to Infants, Toddlers",5.0 out of 5 stars,211
