Name,Rating,Price(INR)
"Energize Your Mind: A Monk’s Guide to Mindful Living: Learn the Art of Mastering Your Thoughts, Feelings and Emotions",4.6 out of 5 stars,195
"The Power of Your Subconscious Mind (PREMIUM PAPERBACK, PENGUIN INDIA)",4.5 out of 5 stars,91
Very First Sight Words Sentences Level - 1,4.5 out of 5 stars,140
"The Book of Five Rings by Miyamoto Musashi - Timeless Wisdom on Strategy, Martial Arts, and the Way of the Samurai for Modern Success",4.3 out of 5 stars,116
"Grandma's Bag of Stories: Collection of 20+ Illustrated short stories, traditional Indian folk tales for all ages for children of all ages by Sudha Murty [Paperback] Sudha Murty",4.6 out of 5 stars,167
"Little Colouring Books for Kids (Set of 10 Books) - Gift to children for painting, drawing and colouring - Alphabets, Animals, Birds, Flags, Flowers, ... Transport, Vegetables - 3 to 6 years old",4.3 out of 5 stars,210
Mandala Art: Colouring books for Adults with tear out sheets,4.5 out of 5 stars,149
Brain Activity Book for Kids - 200+ Activities for Age 3+,4.5 out of 5 stars,100
My First Library: Boxset of 10 Board Books for Kids,4.5 out of 5 stars,399
Dopamine Detox : A Short Guide to Remove Distractions and Get Your Brain to Do Hard Things (Productivity Series Book 1),4.3 out of 5 stars,0
"My First Mythology Tale (Illustrated) (Set of 5 Books) - Mahabharata, Krishna, Hanuman, Ganesha, Ramayana - Story Book for Kids - English Short Stories with Colourful Pictures - Read Aloud to Infants, Toddlers",4.4 out of 5 stars,193
5000 + Daily Use English Sentences | Kanchan Keshari,4.2 out of 5 stars,273
Animals Tales From Panchtantra: Timeless Stories for Children From Ancient India,4.5 out of 5 stars,179
My First Book of Pencil Control : Practice Pattern Writing (Full Color Pages): Patterns Practice book for kids (Pattern Writing),4.4 out of 5 stars,86
The Magic Of The Lost Story,4.6 out of 5 stars,176
"Moral Story Books for Kids (Set of 10 Books) (Illustrated) - English Short Stories with Colourful Pictures - Bedtime Children Story Book - 3 Years to 6 Years Old Children - Read Aloud to Infants, Toddlers",4.5 out of 5 stars,245
The Power of Your Subconscious Mind,4.5 out of 5 stars,85
Brain Activity Book for Kids - 200+ Activities for Age 5+,4.4 out of 5 stars,98
"My First Shaped Board book - Elephant, Die-Cut Animals, Picture Book for Children",4.5 out of 5 stars,89
"Phonic Reader (Illustrated) (Set of 6 Books) - Story Book for Kids - Bedtime Stories - 2 Years to 6 Years Old - Read Aloud to Infants, Toddlers",4.2 out of 5 stars,168
My First Padded Board Books of Times Table: Multiplication Tables From 1 - 20,4.6 out of 5 stars,169
365 Maths Activity Book For Kids: Age 5+,4.5 out of 5 stars,149
The Subtle Art of Not Giving a F*ck: A Counterintuitive Approach to Living a Good Life (Mark Manson Collection Book 1),4.5 out of 5 stars,155
Atomic Habits: the life-changing million-copy #1 bestseller,4.6 out of 5 stars,353
Master Your Emotions: A Practical Guide to Overcome Negativity and Better Manage Your Feelings (Mastery Series Book 1),4.5 out of 5 stars,0
Tuesdays With Morrie: The most uplifting book ever written about the importance of human connection,4.6 out of 5 stars,170
Death; An Inside Story: A book for all those who shall die,4.7 out of 5 stars,188
I Hear You,4.7 out of 5 stars,199
The Book Thief: TikTok made me buy it! The life-affirming international bestseller,4.6 out of 5 stars,280
"Self Love: Woman's book for a happy life (happiness, mindfulness, wellness, self-confidence)",4.1 out of 5 stars,0
War Of Lanka (Ram Chandra Series Book 4),4.3 out of 5 stars,232
"Anxiety: The Only Book You Will Need To Rewire Your Anxious Brain Into Gaining Self Confidence (Depression, Stress, Anger, Stop Worrying, Panic, Fear, Shyness, Healing)",3.8 out of 5 stars,0
The Art Of Self Hypnosis: Hypnotize Yourself To Success (Hypnotic Horizons : Unlock the Secrets of the Mind Book 1),5.0 out of 5 stars,0
Picture Books Collection for Early Learning (Set of 12),4.3 out of 5 stars,221
A Scarred Wallflower for the Duke: A Historical Regency Romance Novel (Imperfect Duchesses Book 3),4.6 out of 5 stars,0
SSC Maths 6800 TCS MCQ chapter wise 4th edition english medium I detailed explanation and short tricks,4.6 out of 5 stars,499
Brain Activity Book for Kids - 200+ Activities for Age 6+,4.5 out of 5 stars,100
Focus : Read this book if you want to learn more about focus,5.0 out of 5 stars,0
My First Animal Sticker Book: Exciting Sticker Book With 100 Stickers,4.4 out of 5 stars,169
The Scarred Viscount’s Redemption: A Clean Historical Regency Romance Book (Broken Hearts' Redemption 2),,0
SSC English 7600 TCS MCQ chapter wise with detailed explanation 4th edition english medium,4.4 out of 5 stars,499
SSC Reasoning 7200 TCS MCQ chapter wise 4th edition english medium,4.2 out of 5 stars,499
101 Pencil Control Activity Book For Kids: Tracing Practise Book Age 2+,4.5 out of 5 stars,139
B.Ed. Guide Book for Gauhati University B.Ed. CET-2020,4.4 out of 5 stars,0
Trading Chart Pattern [Breakout + Candlestick+Other] | Complete Book | Trading Book,3.8 out of 5 stars,200
"MTG National Science Olympiad (NSO) Workbook for Class 5 - Quick Recap, MCQs, Previous Years Solved Paper and Achievers Section - SOF Olympiad Preparation Books For 2023-2024 Exam",,85
Arabic calligraphy practice book: Specially for thuluth font,4.1 out of 5 stars,0
Energize Your Mind + Lifes amazing secrets 2 Book Combo,,299
The Book Tree Baby Box Gift Set of Small 6 Board Book for Children Age 0 - 2 Years- 12 Pages Board Book,4.2 out of 5 stars,299
Detective Alfa aani Ratnajadit Khanjirache Rahasya (Detective Alfa Series Book 1) (Marathi Edition),4.3 out of 5 stars,0
CUET 2023 Commerce Domain Based on Class 12 NCERT Conducted BY NTA Including Solved Papers 2022 Including Free Online Mock Test (English Medium) (4146),3.3 out of 5 stars,476
NTA NEET (UG) BIOLOGY | RAKSHITA SINGH,3.6 out of 5 stars,0
"Accounting Principles, Industrial Relations & Labour Laws for UPSC EPFO (EO/ AO/ APFC) Exam",4.8 out of 5 stars,179
Addition and Subtraction Activity Book For Children - 80+ Activities Inside,4.7 out of 5 stars,135
War And Peace,4.5 out of 5 stars,85
201 Sight Words And Sentence (With 800+ Sentences To Read): Activity Book For Children,4.4 out of 5 stars,129
"Cursive Writing Books (Set of 5 Books) (Handwriting Practice Books) - Small Letters, Capital Letters, Joining Letters, Sentences, Words for Age 3-7: ... Letters, Joing Letters, Sentences, Words",4.4 out of 5 stars,301
The Communist Manifesto,4.4 out of 5 stars,85
"108 Panchatantra Stories for Children (Illustrated) - Story Book for Kids - Moral Stories - Bedtime Stories - 3 Years to 10 Years Old - English Short Stories for Children - Read Aloud to Infants, Toddlers",4.4 out of 5 stars,128
Price Action Trading : Technical Analysis Simplified!,4.3 out of 5 stars,320
Bharani's Big Book of Facts : 1000 Things You Should Know You Didn't Know,,0
Rich Dad Poor Dad : What The Rich Teach Their Kids About Money That The Poor And Middle Class Do Not!: (25th Anniversary Edition),4.6 out of 5 stars,294
Brilliant Brain Activity Book 7+,4.4 out of 5 stars,175
மஞ்சத்து பைங்கிளிகள் : Tamil romance novel (Tamil Edition),,0
Trading Chart Breakout Pattern & Candlestick Pattern Pocket Study For Beginners,4.1 out of 5 stars,219
அன்பே சித்தாரா : Tamil modern romance novel (Tamil Edition),,0
FOREST GUARD BOOK YUVA UPNISHAD | YUVA UPNISHAD VANRAKSHAK BOOK | YUVA FOREST GUARD BEAT GUARD BOOK,4.3 out of 5 stars,214
World's Greatest Leaders: Biographies of Inspirational Personalities For Kids,4.4 out of 5 stars,99
Brain Boosting Activity Book for Kids – 200+ Activities for Age 3+,4.4 out of 5 stars,100
The Fantasy Writer's Handbook: 1250 Writing Prompts in 25 Subgenres to Unleash Your Fantasy World-Building Skills,,0
"12th Edition, 2023 A Competitive Book of Agriculture (English Edition) By Nem Raj Sunda",3.9 out of 5 stars,311
"Trading Chart Pattern book | Breakout Pattern, Candlestick Pattern & other Patterns | Trading Book for Beginners | Useful for Share Market, Forex Trading, Commodity Market, Intraday, Option Chain, Stocks etc",4.3 out of 5 stars,149
LIFES AMAZING SECRETS,4.6 out of 5 stars,162
"The Collected Works of John Buchan (Illustrated): Spy Classics, Thrillers, Adventure Novels, Mystery Novels, Historical Works, Scottish Poems, Essays, & World War I Books",4.5 out of 5 stars,77
SSC General Studies 6500 TCS MCQ chapter wise english medium 4th edition,4.5 out of 5 stars,499
Sherlock Holmes : Complete Collection,4.4 out of 5 stars,152
Simplified Year Book 2023 - Chalu Ghadamodi Dairy 26 th 2023,4.2 out of 5 stars,247
Encyclopedia: Amazing Questions & Answers Science,4.5 out of 5 stars,143
The Secret Garden,4.4 out of 5 stars,171
101 Panchatantra Stories for Children: Colourful Illustrated Story book,4.5 out of 5 stars,169
"TARGET MHT-CET Online Engineering Test 2023 - 7 Previous Year Solved Papers (2022 - 2016) & 10 Mock Tests (7 in Book + 3 Online) 5th Edition | Maharashtra Common Entrance Test | PYQs Question Bank | Physics, Chemistry & Mathematics |",4.5 out of 5 stars,271
Mandala: Colouring books for Adults with tear out sheets,4.5 out of 5 stars,129
"Sanghariyat Magic Practice Copy Book for Pre-School Kids, Re-Usable Drawing, Alphabet, Numbers and Math Exercise , English Magic Book for Children (4 x Books,5 x Refill,1 x Pen,1 x Grip),Multicolor",4.2 out of 5 stars,198
Agent 67,5.0 out of 5 stars,99
"Story Book for Kids - First Reader (Illustrated) (Set of 6 Books) - Phonic stories - Bedtime Stories - 2 Years to 6 Years Old - Read Aloud to Infants, Toddlers",4.1 out of 5 stars,143
"Brain Booster Activity Book Set (Set of 10 books) (Colourful Pages) - 3 Years to 5 Years Old - Learn and Practice ABC Capital and Small Letters, Mazes, Spot the Difference, Pencil Control, Dot to Dot, Mathematics - Fun Early Learning",4.3 out of 5 stars,272
Macmillan CAIIB - New Syllabus 2023 - Advanced Business & Financial Management + Banking Regulations & Business Laws - Set of 2 Books by IIBF - 2023-24/Ed,3.2 out of 5 stars,"1,595"
BlackBook of English Vocabulary March 2023 by Nikhil Gupta,4.5 out of 5 stars,314
101 Brain Booster Activity Book: Fun Activity Book For Children,4.4 out of 5 stars,149
"God, The Mother",5.0 out of 5 stars,82
SSC General Studies 6500 TCS MCQ chapter wise hindi medium 4th edition,4.5 out of 5 stars,489
Unwanted 24: Book one in Unwanted series (Indian fiction),4.6 out of 5 stars,0
(Hindi Book) Price Action Trading Technical Analysis Hindi,4.2 out of 5 stars,335
Nehru Files: Nehru Ki 127 Aitihasik Galtiyan (Hindi Translation of Nehru’s 127 Major Blunders) (Hindi Edition),4.6 out of 5 stars,472
"108 Akbar and Birbal Stories (Illustrated) - Story Book for Kids - Classic Tales of India - Bedtime Stories - 4 Years to 10 Years Old - English Short Stories for Children -  Read Aloud to Infants, Toddlers",4.4 out of 5 stars,125
"The Little Book of Stoicism: Timeless Wisdom to Gain Resilience, Confidence, and Calmness",4.5 out of 5 stars,338
The Magic Of The Lost Story,4.6 out of 5 stars,176
Unwanted 24: Book one in Unwanted series (Indian fiction),4.6 out of 5 stars,0
Advanced Problems In Mathmetics For JEE Main & Advanced For Examination 2023-2024,4.6 out of 5 stars,398
"Raa Traders Sank Magic Practice Copybook, (4 BOOK + 10 REFILL+ 2 Pen +2 Grip) Number Tracing Book for Preschoolers with Pen, Magic Calligraphy Copybook Set Practical Reusable Writing Tool Simple Hand Lettering",4.0 out of 5 stars,149
Shlokas and Mantras For Kids - Illustrated Padded Board Book - Learn About India's Rich Culture and Tradition In Three Languages,4.5 out of 5 stars,209
Nursery Rhymes Board Book (My First Book Series): Illustrated Classic Nursery Rhymes,4.6 out of 5 stars,169
அன்பே சித்தாரா : Tamil modern romance novel (Tamil Edition),,0
"MTG National Science Olympiad (NSO) Workbook for Class 2 - Quick Recap, MCQs, Previous Years Solved Paper and Achievers Section - SOF Olympiad Preparation Books For 2023-2024 Exam",,100
(Hindi Book) Price Action Trading Technical Analysis Hindi,4.2 out of 5 stars,335
My First Little Librarian: Boxset of 12 Best Board Books for Kids,4.5 out of 5 stars,399
3rd Edition 2023 Madhya Pradesh Parikshadham ( Madhya Pradesh Samanya Adhyan) Mp GK Book in hindi for Mppsc and Other All Mp Exams,,322
"My First Fun Activity Boxset of 4 Books: Spot the Difference, Mazes, Word Search & Dot to Dot",4.5 out of 5 stars,299
The Fantasy Writer's Handbook: 1250 Writing Prompts in 25 Subgenres to Unleash Your Fantasy World-Building Skills,,0
"MTG International English Olympiad (IEO) Workbook for Class 3 - MCQs, Previous Years Solved Paper and Achievers Section - SOF Olympiad Preparation Books For 2023-2024 Exam",,73
Kurinji / குறிஞ்சி - A Montessori Nature Book about the Mountain Ecosystem (Tamil Board Book with Large Flaps ),5.0 out of 5 stars,425
"MTG International English Olympiad (IEO) Workbook for Class 2 - MCQs, Previous Years Solved Paper and Achievers Section - SOF Olympiad Preparation Books For 2023-2024 Exam",,85
Macmillan CAIIB - New Syllabus 2023 - Advanced Business & Financial Management + Banking Regulations & Business Laws - Set of 2 Books by IIBF - 2023-24/Ed,3.2 out of 5 stars,"1,595"
மஞ்சத்து பைங்கிளிகள் : Tamil romance novel (Tamil Edition),,0
IIITprep UGEE Previous Year Papers 2023 | IIIT Hyderabad,4.5 out of 5 stars,599
My First Shapes and Colours Sticker Book: Exciting Sticker Book With 100 Stickers,4.5 out of 5 stars,169
"MTG International Mathematics Olympiad (IMO) Workbook for Class 5 - MCQs, Previous Years Solved Paper and Achievers Section - SOF Olympiad Preparation Books For 2023-2024 Exam",,71
My First Transport Sticker Book: Exciting Sticker Book With 100 Stickers,4.5 out of 5 stars,169
IELTS 17 Academic Student's Book with Answers with Audio with Resource Bank (South Asian edition),3.2 out of 5 stars,431
Best of Children’s Classics (Set of 5 Books): Perfect Gift Set for Kids,4.4 out of 5 stars,499
"The Collected Works of John Buchan (Illustrated): Spy Classics, Thrillers, Adventure Novels, Mystery Novels, Historical Works, Scottish Poems, Essays, & World War I Books",4.5 out of 5 stars,77
How to Prepare for QUANTITATIVE APTITUDE for CAT |10th Edition | With CAT Practice Tests on Pull Marks,4.5 out of 5 stars,679
KIRAN CUET 2023 Commerce : Domain Based on Class 12 NCERT Conducted BY NTA Including Solved Papers 2022 Including Free Online Mock Test | English Medium | CODE4146 | Based on Class XII NCERT |,,500
Physics Wallah CUET UG General Test Book (Common University Entrance Test 2023),3.3 out of 5 stars,280
Baby Touch: Tummy Time [Board book] Ladybird,4.5 out of 5 stars,268
Sherlock Holmes : Complete Collection,4.4 out of 5 stars,152
"MTG International Mathematics Olympiad (IMO) Workbook for Class 7 - MCQs, Previous Years Solved Paper and Achievers Section - SOF Olympiad Preparation Books For 2023-2024 Exam",5.0 out of 5 stars,76
"MTG International English Olympiad (IEO) Workbook for Class 5 - MCQs, Previous Years Solved Paper and Achievers Section - SOF Olympiad Preparation Books For 2023-2024 Exam",,100
Baby Record Book : Newborn Journal For Boys And Girls To Cherish Memories And Milestones (Ideal Gift For Expecting Parents and Baby Shower),4.4 out of 5 stars,149
Complete Maths Brahamastra formula book for all Competetive Exams,4.1 out of 5 stars,140
The Secret Garden,4.4 out of 5 stars,171
A Comprehensive Guide for OSSSC Panchayat Executive Officer & Junior Assistant Examination 2023 (English Printed Edition) By Adda247,5.0 out of 5 stars,365
"MTG International Mathematics Olympiad (IMO) Workbook for Class 8 - MCQs, Previous Years Solved Paper and Achievers Section - SOF Olympiad Preparation Books For 2023-2024 Exam",5.0 out of 5 stars,85
Cursive Handwriting - Small Letters: Practice Workbook For Children,4.4 out of 5 stars,99
Cyber Encounters: Cops' Adventures with Online Criminals-Hindi Translation (साइबर एनकाउंटर्स),,227
"MTG International English Olympiad (IEO) Workbook for Class 1 - MCQs, Previous Years Solved Paper and Achievers Section - SOF Olympiad Preparation Books For 2023-2024 Exam",,100
"MTG National Science Olympiad (NSO) Workbook for Class 8 - Quick Recap, MCQs, Previous Years Solved Paper and Achievers Section - SOF Olympiad Preparation Books For 2023-2024 Exam",,85
ROOT WORD BOOK Word Power,4.3 out of 5 stars,209
"BRAIN GAMES FOR CLEVER KIDS [Paperback] Moore, Gareth",4.3 out of 5 stars,166
"Jumbo Colouring Book - Activity Colouring Book for 3 to 5 years old kids - Gift to children for painting, drawing and colouring with reference guide",4.4 out of 5 stars,100
Agent 67,5.0 out of 5 stars,99
World's Greatest Leaders: Biographies of Inspirational Personalities For Kids,4.4 out of 5 stars,99
"MTG International Mathematics Olympiad (IMO) Workbook for Class 3 - MCQs, Previous Years Solved Paper and Achievers Section - SOF Olympiad Preparation Books For 2023-2024 Exam",4.5 out of 5 stars,85
"Cursive Handwriting - Small Letters, Capital Letters, Joining Letters and Word Family : Level 1 Practice Workbooks For Children (Set of 4 Books)",4.4 out of 5 stars,399
"MTG International Mathematics Olympiad (IMO) Workbook for Class 3 - MCQs, Previous Years Solved Paper and Achievers Section - SOF Olympiad Preparation Books For 2023-2024 Exam",4.5 out of 5 stars,85
"Cursive Handwriting - Small Letters, Capital Letters, Joining Letters and Word Family : Level 1 Practice Workbooks For Children (Set of 4 Books)",4.4 out of 5 stars,399
"My First Library of Learning: Box set, Complete collection of 10 early learning board books for super kids, 0 to 3 | ABC, Colours, Opposites, Numbers, ... toddler) (My First Book of)",4.5 out of 5 stars,351
Spoken English Course | Zero Level To Hero Level | English Lover | Satender Singh,3.9 out of 5 stars,256
Multiplication and Division Activity Book For Children - 80+ Activities Inside,3.9 out of 5 stars,144
100 Words Reusable Sticker Book For Children,3.4 out of 5 stars,199
COMBO : Intraday Trading Hindi Book + Technical Analysis Candlesticks Hindi Book,3.8 out of 5 stars,470
"God, The Mother",5.0 out of 5 stars,82
SSC Maths 6800 TCS MCQ chapter wise 4th edition hindi medium,4.1 out of 5 stars,489
"Writing Practice Boxset: Pack of 4 Books (Writing Fun: Write And Practice Capital Letters, Small Letters, Patterns and Numbers 1 to 10)",4.3 out of 5 stars,199
"Magic of the Lost Temple, The",4.6 out of 5 stars,188
"The Little Book of Stoicism: Timeless Wisdom to Gain Resilience, Confidence, and Calmness",4.5 out of 5 stars,338
BlackBook of General Awareness January 2023 by Nikhil Gupta,4.5 out of 5 stars,340
3D MAGIC BOOK (2 FREE MAGIC 3D GLASSES included) | PREMIUM Birthday Gift or Return Gift For Kids Birthday 6 7 8 9 10 year old boy girl child,4.3 out of 5 stars,169
Red Book of Super Fast Spoken English | Dharmendra Sir | DSL,5.0 out of 5 stars,214
INDIA - Fun Activity Book for Children,3.5 out of 5 stars,149
The Hidden Hindu 3,4.5 out of 5 stars,209
"MTG National Science Olympiad (NSO) Workbook for Class 7 - Quick Recap, MCQs, Previous Years Solved Paper and Achievers Section - SOF Olympiad Preparation Books For 2023-2024 Exam",,85
MANORMA YEAR BOOK 2023 (ENG),4.5 out of 5 stars,280
"108 Stories from the Vedas, the Puranas and the Upanishads for Children (Illustrated) - Story Book for Kids - Bedtime Stories - 4 Years to 10 Years ... Children - Read Aloud to Infants, Toddlers",4.3 out of 5 stars,125
The Illustrated Stories of Akbar and Birbal: Classic Tales From India,4.6 out of 5 stars,168
"My First 1000 Words: Early Learning Picture Book to learn Alphabet, Numbers, Shapes and Colours, Transport, Birds and Animals, Professions, Opposite Words, Action Words, Parts of the body and Objects Around Us.",4.5 out of 5 stars,149
Rules For The Dance: A Handbook for Writing and Reading Metrical Verse,4.6 out of 5 stars,449
"NCERT , CLASS - 11 SET OF 5 BOOKS ( PHYSICS PART 1 & 2 , CHEMISTRY PART 1 & 2 , MATHEMATICS ) 2022 EDITION",2.9 out of 5 stars,744
"Story Books for Kids - Fairy Tales (Illustrated) (Set of 12 Books) - Bedtime children Story Books, Read Aloud to Infants, Toddlers - 3 Years to 5 Years old - Rapunzel, Puss in Boots, Little Red Cap, Blacky and Goldy… Beauty and the Beast",4.5 out of 5 stars,294
"Do It Today: Overcome procrastination, improve productivity and achieve more meaningful things [Paperback] Foroux, Darius",4.4 out of 5 stars,109
காலம் கடந்து (Tamil Edition),,0
Life's Amazing Secrets (Marathi),4.6 out of 5 stars,214
The Book You Wish Your Parents Had Read (and Your Children Will Be Glad That You Did): THE #1 SUNDAY TIMES BESTSELLER,4.5 out of 5 stars,309
Shrimad Bhagwat Geeta Yatharoop,4.8 out of 5 stars,215
Activity Book for Kids - Maths for Age 5+,4.5 out of 5 stars,98
Sight Words and Sentences Book for Kids,4.5 out of 5 stars,98
"Story Books for Kids - Fairy Tales (Illustrated) (Set of 12 Books) - Bedtime children Story Books, Read Aloud to Infants, Toddlers - 3 Years to 5 Years old - Rapunzel, Puss in Boots, Little Red Cap, Blacky and Goldy… Beauty and the Beast",4.5 out of 5 stars,294
"MTG National Science Olympiad (NSO) Workbook for Class 7 - Quick Recap, MCQs, Previous Years Solved Paper and Achievers Section - SOF Olympiad Preparation Books For 2023-2024 Exam",,85
"Sampurna Ayurvediya / Ayurvedic Garbha Sanskar (5.5Lacks+ Units Sold) Marathi Book by Dr.Balaji Tambe (Sakal Prakashan) | स्त्री आयुर्वेदीय संपूर्ण आयुर्वेदिक गर्भ संस्कार बुक मराठी पुस्तक डॉ. बालाजी तांबे, गर्भवती महिला साठी (Mother & Baby Care, Best Books for Reading During & After Pregnency) - सकाळ प्रकाशन",4.5 out of 5 stars,600
Seek And Find - Animals : Early Learning Board Books With Tabs,4.5 out of 5 stars,198
Rumi's Little Book of Life,4.6 out of 5 stars,0
Preschool Activity Book: Brain Booster - Logical Reasoning Activity Book For Kids,4.6 out of 5 stars,109
Animal Fun Reusable Sticker Book For Children,3.3 out of 5 stars,199
Jolly Kids Baby's First High Contrast Book Set for Newborns Age 0-12 months (Set of 4) | Board Book | Black & White Book,5.0 out of 5 stars,570
"MHT-CET Triumph Physics Chemistry and Maths (PCM) Books for Engineering & Pharmacy Entrance Exam | On 11 and 12 Maharashtra Board Syllabus | Includes Chapterwise MCQs, Question Paper | 3 Books",4.3 out of 5 stars,"1,393"
மெல்லிய நேசம் (Tamil Edition),4.4 out of 5 stars,0
Origami - Step-by-Step Introduction To The Art of Paper-Folding - Activity Book For Children - Level 1: Beginners,4.6 out of 5 stars,109
IAS/IPS Pariksha Mein Safalta Ke Secrets,,199
My First Experiences Sticker Book: My first sticker books,4.4 out of 5 stars,169
"Blossom Moral Story Book for Kids 3 Years to 6 Years Old in English | 31 Fairy Tale Stories with Colourful Pictures | Best Bedtime Children Story Book | Short Stories for Infants, Toddlers | Book A [Paperback] Content Team at Target Publications",4.4 out of 5 stars,71
The Book of Five Rings,4.5 out of 5 stars,171
NCERT TEXTBOOK SCIENCE FOR CLASS- 8TH -854,3.6 out of 5 stars,140
Hello Mr. Pen Cursive Writing Book 5 - Handwriting Improvement Books - Cursive Writing Books for 10+ Years - Hand Writing Practice Books Kids - Writing Book for Kids,4.2 out of 5 stars,160
"Flags of the World - Sticker Coloring Activity Book For Children : Continent, Country, Capital, Language and Currency",4.5 out of 5 stars,249
மெல்லிய நேசம் (Tamil Edition),4.4 out of 5 stars,0
English The Parable of the Pipeline Set of 6 Books - Rich dad the business school +Copycat Marketing +Question are the answer + The parable of the pipeline+Talk the talk +whole stole,3.8 out of 5 stars,397
NCERT Science (PCB) for Class 11 Books Set 11 (English Medium) (5 Books) Hardcover – 1 January 2019,4.0 out of 5 stars,710
PSI-STI-ASO - Pariksha Margadarshak - Tatyancha Thokla - Eknath Patil (Tatya) - 30th Ed./2023,4.4 out of 5 stars,490
"MTG International Mathematics Olympiad (IMO) Workbook for Class 9 - MCQs, Previous Years Solved Paper and Achievers Section - SOF Olympiad Preparation Books For 2023-2024 Exam",,78
"108 Moral Stories (Illustrated) - Story Book for Kids - English Short Stories with Colourful Pictures - Bedtime Children Story Book - 4 Years to 10 Years Old Children - Read Aloud to Infants, Toddlers",4.4 out of 5 stars,125
"How the Earth Got Its Beauty: Puffin Chapter Book: Gorgeous new full colour, illustrated chapter book for young readers from ages 5 and up by Sudha Murty [Hardcover] Murty, Sudha",4.6 out of 5 stars,160
BOOKS OF CHART PATTERNS AND CANDLESTICK PATTERNS (HINDI EDITION),5.0 out of 5 stars,289
"Dean Daddy (Yes, Daddy Book 35)",4.6 out of 5 stars,0
"MTG National Science Olympiad (NSO) Workbook for Class 6 - Quick Recap, MCQs, Previous Years Solved Paper and Achievers Section - SOF Olympiad Preparation Books For 2023-2024 Exam",,100
"Ikigai: The Japanese secret to a long and happy life [Hardcover] García, Héctor and Miralles, Francesc",4.6 out of 5 stars,329
"The Book of Ichigo Ichie: The Art of Making the Most of Every Moment, the Japanese Way",4.6 out of 5 stars,313
"IIBF-JAIIB: New 2023 Syllabus & Pattern - 2000 Practice Questions & Solutions | Indian Economy and Financial System (IE&IFS), Principles and Practices of Banking (PPB), Accounting & Financial Management for Bankers (AFM), Retail Banking and Wealth Management (RBWM)",4.3 out of 5 stars,494
